{
  "package_id": "PLG-2026-09-26-01",
  "generated_at": "2026-09-26T09:00:00+08:00",
  "rules_version": "status-rules-v1.0",
  "targets": [
    {
      "target_id": "T-HS-01",
      "domain": "public_housing",
      "title": "五年内建成公营房屋单位",
      "metric_code": "HS-UNIT",
      "metric_name": "期内建成公营房屋单位（累计）",
      "direction": "maximize",
      "baseline": {
        "value": 0,
        "as_of": "2025-03-31",
        "metric_version": "v1"
      },
      "target_value": 196000,
      "unit": "个",
      "period_start": "2025-04-01",
      "period_end": "2030-03-31",
      "responsible_orgs": [
        {
          "org_code": "HB",
          "name": "房屋局（样例）",
          "role": "lead"
        },
        {
          "org_code": "HD",
          "name": "房屋署（样例）",
          "role": "supporting"
        }
      ],
      "budget": [
        {
          "amount_hkd_million": 42000,
          "fiscal_year": "2025-26",
          "status": "approved"
        },
        {
          "amount_hkd_million": 39800,
          "fiscal_year": "2025-26",
          "status": "spent"
        },
        {
          "amount_hkd_million": 45500,
          "fiscal_year": "2026-27",
          "status": "approved"
        }
      ],
      "linked_spatial_project_ids": [
        "SP-HS-01",
        "SP-HS-02"
      ],
      "linked_consultation_ids": [
        "CON-001"
      ],
      "locked": true,
      "history": [
        {
          "at": "2025-04-01T09:00:00+08:00",
          "event": "published",
          "detail": "随五年规划公布：196000 个公营房屋单位",
          "by_org": "HB"
        },
        {
          "at": "2025-04-01T09:05:00+08:00",
          "event": "locked",
          "detail": "五年目标值锁定，年度方案只能调整实现路径",
          "by_org": "HB"
        }
      ]
    },
    {
      "target_id": "T-HS-02",
      "domain": "public_housing",
      "title": "缩短公屋一般申请者平均轮候时间",
      "metric_code": "HS-LTM",
      "metric_name": "一般申请者平均轮候时间",
      "direction": "minimize",
      "baseline": {
        "value": 5.3,
        "as_of": "2025-03-31",
        "metric_version": "v1"
      },
      "target_value": 3.0,
      "unit": "年",
      "period_start": "2025-04-01",
      "period_end": "2030-03-31",
      "responsible_orgs": [
        {
          "org_code": "HB",
          "name": "房屋局（样例）",
          "role": "lead"
        },
        {
          "org_code": "HD",
          "name": "房屋署（样例）",
          "role": "supporting"
        }
      ],
      "budget": [
        {
          "amount_hkd_million": 320,
          "fiscal_year": "2025-26",
          "status": "spent"
        },
        {
          "amount_hkd_million": 360,
          "fiscal_year": "2026-27",
          "status": "approved"
        }
      ],
      "linked_spatial_project_ids": [],
      "linked_consultation_ids": [
        "CON-001"
      ],
      "locked": true,
      "history": [
        {
          "at": "2025-04-01T09:00:00+08:00",
          "event": "published",
          "detail": "五年末平均轮候时间降至 3.0 年",
          "by_org": "HB"
        },
        {
          "at": "2025-04-01T09:05:00+08:00",
          "event": "locked",
          "detail": "目标锁定",
          "by_org": "HB"
        }
      ]
    },
    {
      "target_id": "T-SF-01",
      "domain": "subdivided_flats",
      "title": "完成劣质劏房处所治理（合规或取缔）",
      "metric_code": "SF-PRM",
      "metric_name": "完成治理的不合标准处所（累计）",
      "direction": "maximize",
      "baseline": {
        "value": 0,
        "as_of": "2025-03-31",
        "metric_version": "v1"
      },
      "target_value": 20000,
      "unit": "处",
      "period_start": "2025-04-01",
      "period_end": "2030-03-31",
      "responsible_orgs": [
        {
          "org_code": "HB",
          "name": "房屋局（样例）",
          "role": "lead"
        },
        {
          "org_code": "BD",
          "name": "屋宇署（样例）",
          "role": "supporting"
        },
        {
          "org_code": "FEHD",
          "name": "食物环境衞生署（样例）",
          "role": "supporting"
        }
      ],
      "budget": [
        {
          "amount_hkd_million": 180,
          "fiscal_year": "2025-26",
          "status": "spent"
        },
        {
          "amount_hkd_million": 180,
          "fiscal_year": "2026-27",
          "status": "approved"
        },
        {
          "amount_hkd_million": 120,
          "fiscal_year": "2026-27",
          "status": "revised"
        }
      ],
      "linked_spatial_project_ids": [],
      "linked_consultation_ids": [
        "CON-001",
        "CON-002"
      ],
      "locked": true,
      "history": [
        {
          "at": "2025-04-01T09:00:00+08:00",
          "event": "published",
          "detail": "已识别约 20000 处不合标准处所，五年内完成治理",
          "by_org": "HB"
        },
        {
          "at": "2025-04-01T09:05:00+08:00",
          "event": "locked",
          "detail": "目标锁定",
          "by_org": "HB"
        },
        {
          "at": "2026-05-18T15:00:00+08:00",
          "event": "rewrite_rejected",
          "detail": "2026-27 年度方案草拟稿拟以「已视察处所」替换「完成治理处所」口径并下调分母，被目标治理机制拒绝：在未附口径桥接的情况下径换分母等同改写五年目标",
          "by_org": "HB"
        }
      ]
    },
    {
      "target_id": "T-HC-01",
      "domain": "healthcare_beds",
      "title": "五年内净增公立医院病床",
      "metric_code": "HC-BED",
      "metric_name": "公立医院病床净增数目（累计）",
      "direction": "maximize",
      "baseline": {
        "value": 0,
        "as_of": "2025-03-31",
        "metric_version": "v1"
      },
      "target_value": 3000,
      "unit": "张",
      "period_start": "2025-04-01",
      "period_end": "2030-03-31",
      "responsible_orgs": [
        {
          "org_code": "HHB",
          "name": "医务衞生局（样例）",
          "role": "lead"
        },
        {
          "org_code": "HA",
          "name": "医院管理局（样例）",
          "role": "supporting"
        }
      ],
      "budget": [
        {
          "amount_hkd_million": 8600,
          "fiscal_year": "2025-26",
          "status": "spent"
        },
        {
          "amount_hkd_million": 9200,
          "fiscal_year": "2026-27",
          "status": "approved"
        }
      ],
      "linked_spatial_project_ids": [
        "SP-HC-01",
        "SP-HC-02"
      ],
      "linked_consultation_ids": [
        "CON-001"
      ],
      "locked": true,
      "history": [
        {
          "at": "2025-04-01T09:00:00+08:00",
          "event": "published",
          "detail": "五年净增 3000 张公立医院病床",
          "by_org": "HHB"
        },
        {
          "at": "2025-04-01T09:05:00+08:00",
          "event": "locked",
          "detail": "目标锁定",
          "by_org": "HHB"
        }
      ]
    },
    {
      "target_id": "T-DH-01",
      "domain": "district_health",
      "title": "扩展地区康健中心网络受惠规模",
      "metric_code": "DHC-SVC",
      "metric_name": "康健中心累计服务（口径见桥接 BR-DHC-01）",
      "direction": "maximize",
      "baseline": {
        "value": 0,
        "as_of": "2025-03-31",
        "metric_version": "v1"
      },
      "target_value": 800000,
      "unit": "人（v1 登记会员）",
      "period_start": "2025-04-01",
      "period_end": "2030-03-31",
      "responsible_orgs": [
        {
          "org_code": "HHB",
          "name": "医务衞生局（样例）",
          "role": "lead"
        },
        {
          "org_code": "DH",
          "name": "衞生署（样例）",
          "role": "supporting"
        }
      ],
      "budget": [
        {
          "amount_hkd_million": 740,
          "fiscal_year": "2025-26",
          "status": "spent"
        },
        {
          "amount_hkd_million": 910,
          "fiscal_year": "2026-27",
          "status": "approved"
        }
      ],
      "linked_spatial_project_ids": [
        "SP-DH-01"
      ],
      "linked_consultation_ids": [
        "CON-001",
        "CON-003"
      ],
      "locked": true,
      "history": [
        {
          "at": "2025-04-01T09:00:00+08:00",
          "event": "published",
          "detail": "v1 口径：登记会员 800000 人",
          "by_org": "HHB"
        },
        {
          "at": "2025-04-01T09:05:00+08:00",
          "event": "locked",
          "detail": "目标按 v1 口径锁定",
          "by_org": "HHB"
        },
        {
          "at": "2026-04-01T00:00:00+08:00",
          "event": "clarified",
          "detail": "口径经 REV-004 改为 v2 服务人次，附桥接 BR-DHC-01 并重述历史；五年目标 v1 等效值 800000 不变",
          "by_org": "HHB"
        }
      ]
    },
    {
      "target_id": "T-YT-01",
      "domain": "youth",
      "title": "青年实习、交流与住屋项目受惠人数",
      "metric_code": "YTH-CNT",
      "metric_name": "青年项目受惠人数（累计）",
      "direction": "maximize",
      "baseline": {
        "value": 0,
        "as_of": "2025-03-31",
        "metric_version": "v1"
      },
      "target_value": 80000,
      "unit": "人",
      "period_start": "2025-04-01",
      "period_end": "2030-03-31",
      "responsible_orgs": [
        {
          "org_code": "HAB",
          "name": "民政及青年事务局（样例）",
          "role": "lead"
        }
      ],
      "budget": [
        {
          "amount_hkd_million": 260,
          "fiscal_year": "2025-26",
          "status": "spent"
        },
        {
          "amount_hkd_million": 300,
          "fiscal_year": "2026-27",
          "status": "approved"
        }
      ],
      "linked_spatial_project_ids": [
        "SP-YT-01"
      ],
      "linked_consultation_ids": [
        "CON-001"
      ],
      "locked": true,
      "history": [
        {
          "at": "2025-04-01T09:00:00+08:00",
          "event": "published",
          "detail": "五年 80000 名青年受惠",
          "by_org": "HAB"
        },
        {
          "at": "2025-04-01T09:05:00+08:00",
          "event": "locked",
          "detail": "目标锁定",
          "by_org": "HAB"
        }
      ]
    }
  ],
  "milestones": [
    {
      "milestone_id": "MS-HS01-Q1",
      "target_id": "T-HS-01",
      "plan_id": "PLAN-2526",
      "sequence": 1,
      "title": "2025年第1季度量化节点",
      "metric_code": "HS-UNIT",
      "metric_version": "v1",
      "planned_value": 9800,
      "unit": "个",
      "due_date": "2025-06-30",
      "forecast_date": null,